{
  "meta": {
    "version": 1,
    "projection": "tethys-wcs",
    "bounds": [0, 0, 1, 1],
    "notes": "Northern/eastern sea margins reserved for Book 2 expansion"
  },
  "regions": {
    "watcher_volcano": {
      "center": [0.52, 0.78],
      "radius": 0.06,
      "elevation": 0.92,
      "type": "volcanic",
      "danger": "extreme",
      "fogProfile": "fractured",
      "journalStamp": "watcher-volcano",
      "vr": {
        "lodHint": "critical",
        "audioZone": "deep_rumble",
        "occlusion": "heavy",
        "heightSource": "procedural"
      }
    },
    "watcher_flats": {
      "center": [0.54, 0.74],
      "radius": 0.05,
      "elevation": 0.6,
      "type": "wild",
      "danger": "high",
      "fogProfile": "leaking",
      "journalStamp": "watcher-flats",
      "vr": {
        "lodHint": "landmark",
        "audioZone": "stone_tick",
        "occlusion": "none",
        "heightSource": "flat"
      }
    },
    "mystic_woods": {
      "center": [0.48, 0.65],
      "radius": 0.09,
      "elevation": 0.42,
      "type": "mystic",
      "danger": "moderate",
      "fogProfile": "leaking",
      "journalStamp": "mystic-woods",
      "vr": {
        "lodHint": "critical",
        "audioZone": "spore_hum",
        "occlusion": "light",
        "heightSource": "procedural"
      }
    },
    "sky_city": {
      "center": [0.55, 0.72],
      "radius": 0.04,
      "elevation": 0.85,
      "type": "city",
      "danger": "high",
      "fogProfile": "stable",
      "journalStamp": "sky-city",
      "vr": {
        "lodHint": "critical",
        "audioZone": "muffled_air",
        "occlusion": "heavy",
        "heightSource": "flat"
      }
    },
    "ironwood": {
      "center": [0.44, 0.58],
      "radius": 0.07,
      "elevation": 0.48,
      "type": "forest",
      "danger": "moderate",
      "fogProfile": "stable",
      "journalStamp": "ironwood",
      "vr": {
        "lodHint": "landmark",
        "audioZone": "deep_forest",
        "occlusion": "light",
        "heightSource": "procedural"
      }
    },
    "cambria": {
      "center": [0.42, 0.58],
      "radius": 0.06,
      "elevation": 0.3,
      "type": "ruins",
      "danger": "moderate",
      "fogProfile": "stable",
      "journalStamp": "cambria",
      "vr": {
        "lodHint": "landmark",
        "audioZone": "water_stone",
        "occlusion": "light",
        "heightSource": "flat"
      }
    },
    "pteros_island": {
      "center": [0.36, 0.52],
      "radius": 0.04,
      "elevation": 0.25,
      "type": "coastal",
      "danger": "moderate",
      "fogProfile": "stable",
      "journalStamp": "pteros-island",
      "vr": {
        "lodHint": "background",
        "audioZone": "shore_wind",
        "occlusion": "light",
        "heightSource": "flat"
      }
    },
    "thal_regions": {
      "center": [0.68, 0.60],
      "radius": 0.08,
      "elevation": 0.22,
      "type": "coastal",
      "danger": "moderate",
      "fogProfile": "opaque",
      "journalStamp": "thal-regions",
      "vr": {
        "lodHint": "background",
        "audioZone": "distant_surf",
        "occlusion": "none",
        "heightSource": "flat"
      }
    },
    "cimmeria": {
      "center": [0.30, 0.46],
      "radius": 0.05,
      "elevation": 0.28,
      "type": "ruins",
      "danger": "high",
      "fogProfile": "opaque",
      "journalStamp": "cimmeria",
      "vr": {
        "lodHint": "background",
        "audioZone": "cave_ring",
        "occlusion": "heavy",
        "heightSource": "procedural"
      }
    },
    "tethys_shallows": {
      "center": [0.78, 0.42],
      "radius": 0.18,
      "elevation": 0.12,
      "type": "coastal",
      "danger": "moderate",
      "fogProfile": "opaque",
      "journalStamp": "thal-regions",
      "vr": {
        "lodHint": "background",
        "audioZone": "open_water",
        "occlusion": "none",
        "heightSource": "flat"
      }
    },
    "dier_lake": {
      "center": [0.72, 0.48],
      "radius": 0.09,
      "elevation": 0.18,
      "type": "coastal",
      "danger": "high",
      "fogProfile": "opaque",
      "journalStamp": "thal-regions",
      "vr": {
        "lodHint": "background",
        "audioZone": "brine_still",
        "occlusion": "light",
        "heightSource": "flat"
      }
    },
    "fire_pines_range": {
      "center": [0.50, 0.82],
      "radius": 0.05,
      "elevation": 0.76,
      "type": "forest",
      "danger": "moderate",
      "fogProfile": "stable",
      "journalStamp": "watcher-volcano",
      "vr": {
        "lodHint": "landmark",
        "audioZone": "resin_crack",
        "occlusion": "light",
        "heightSource": "procedural"
      }
    },
    "sulfur_flats": {
      "center": [0.58, 0.72],
      "radius": 0.04,
      "elevation": 0.40,
      "type": "volcanic",
      "danger": "high",
      "fogProfile": "leaking",
      "journalStamp": "watcher-flats",
      "vr": {
        "lodHint": "background",
        "audioZone": "sulfur_hiss",
        "occlusion": "none",
        "heightSource": "flat"
      }
    },
    "gargantua": {
      "center": [0.62, 0.66],
      "radius": 0.06,
      "elevation": 0.35,
      "type": "wild",
      "danger": "moderate",
      "fogProfile": "opaque",
      "journalStamp": "gargantua",
      "vr": {
        "lodHint": "background",
        "audioZone": "far_rumble",
        "occlusion": "light",
        "heightSource": "procedural"
      }
    },
    "garg_isle_giant": {
      "center": [0.60, 0.68],
      "radius": 0.03,
      "elevation": 0.32,
      "type": "wild",
      "danger": "high",
      "fogProfile": "stable",
      "journalStamp": "gargantua",
      "vr": {
        "lodHint": "background",
        "audioZone": "low_drum",
        "occlusion": "light",
        "heightSource": "procedural"
      }
    },
    "garg_isle_dwarf": {
      "center": [0.64, 0.64],
      "radius": 0.025,
      "elevation": 0.31,
      "type": "wild",
      "danger": "moderate",
      "fogProfile": "leaking",
      "journalStamp": "gargantua",
      "vr": {
        "lodHint": "background",
        "audioZone": "quick_chatter",
        "occlusion": "none",
        "heightSource": "procedural"
      }
    },
    "garg_isle_microbial": {
      "center": [0.66, 0.70],
      "radius": 0.02,
      "elevation": 0.30,
      "type": "wild",
      "danger": "high",
      "fogProfile": "opaque",
      "journalStamp": "gargantua",
      "vr": {
        "lodHint": "background",
        "audioZone": "air_wrong",
        "occlusion": "light",
        "heightSource": "flat"
      }
    },
    "thrymreach": {
      "center": [0.58, 0.72],
      "radius": 0.12,
      "elevation": 0.4,
      "type": "volcanic",
      "danger": "high",
      "fogProfile": "leaking",
      "journalStamp": "gargantua",
      "vr": {
        "lodHint": "background",
        "audioZone": "steam_vent",
        "occlusion": "light",
        "heightSource": "procedural"
      }
    },
    "palimpsest_keys": {
      "center": [0.66, 0.62],
      "radius": 0.1,
      "elevation": 0.34,
      "type": "coastal",
      "danger": "moderate",
      "fogProfile": "stable",
      "journalStamp": "gargantua",
      "vr": {
        "lodHint": "background",
        "audioZone": "reef_breath",
        "occlusion": "none",
        "heightSource": "procedural"
      }
    },
    "lorn_scatter": {
      "center": [0.64, 0.68],
      "radius": 0.12,
      "elevation": 0.33,
      "type": "wild",
      "danger": "moderate",
      "fogProfile": "opaque",
      "journalStamp": "gargantua",
      "vr": {
        "lodHint": "background",
        "audioZone": "far_ripple",
        "occlusion": "light",
        "heightSource": "procedural"
      }
    },
    "sulfur_crown": {
      "center": [0.56, 0.76],
      "radius": 0.08,
      "elevation": 0.45,
      "type": "volcanic",
      "danger": "high",
      "fogProfile": "opaque",
      "journalStamp": "watcher-flats",
      "vr": {
        "lodHint": "background",
        "audioZone": "sulfur_hiss",
        "occlusion": "light",
        "heightSource": "procedural"
      }
    },
    "borok_deep": {
      "center": [0.60, 0.70],
      "radius": 0.03,
      "elevation": 0.32,
      "type": "wild",
      "danger": "high",
      "fogProfile": "stable",
      "journalStamp": "gargantua",
      "vr": {
        "lodHint": "background",
        "audioZone": "low_drum",
        "occlusion": "light",
        "heightSource": "procedural"
      }
    },
    "khars_back": {
      "center": [0.62, 0.70],
      "radius": 0.028,
      "elevation": 0.34,
      "type": "wild",
      "danger": "high",
      "fogProfile": "stable",
      "journalStamp": "gargantua",
      "vr": {
        "lodHint": "background",
        "audioZone": "wind_slope",
        "occlusion": "light",
        "heightSource": "procedural"
      }
    },
    "mineth": {
      "center": [0.63, 0.66],
      "radius": 0.02,
      "elevation": 0.31,
      "type": "wild",
      "danger": "moderate",
      "fogProfile": "leaking",
      "journalStamp": "gargantua",
      "vr": {
        "lodHint": "background",
        "audioZone": "quick_chatter",
        "occlusion": "none",
        "heightSource": "procedural"
      }
    },
    "mynz": {
      "center": [0.635, 0.655],
      "radius": 0.016,
      "elevation": 0.31,
      "type": "wild",
      "danger": "high",
      "fogProfile": "leaking",
      "journalStamp": "gargantua",
      "vr": {
        "lodHint": "background",
        "audioZone": "quick_chatter",
        "occlusion": "none",
        "heightSource": "procedural"
      }
    },
    "splitlings_north": {
      "center": [0.64, 0.62],
      "radius": 0.018,
      "elevation": 0.30,
      "type": "wild",
      "danger": "moderate",
      "fogProfile": "stable",
      "journalStamp": "gargantua",
      "vr": {
        "lodHint": "background",
        "audioZone": "tidal_pull",
        "occlusion": "none",
        "heightSource": "procedural"
      }
    },